{
  "$schema": "https://json-schema.org/draft/2020-12/schema",
  "$id": "https://juicemount.contract/v1/cache-status.schema.json",
  "title": "CacheStatus",
  "description": "GET /cache-status — aggregate + per-root warm progress, live prefetcher state, capacity verdict, and in-flight scans. The RC bridge emits the normalized snake_case v1 form; capacity and scanning are always present.",
  "type": "object",
  "additionalProperties": false,
  "required": ["aggregate", "roots", "live", "offline_mode", "capacity", "scanning"],
  "properties": {
    "aggregate": { "$ref": "#/$defs/rootStats" },
    "roots": {
      "type": "array",
      "description": "Per-pin-root summaries; always an array, empty when no pin roots.",
      "items": {
        "allOf": [{ "$ref": "#/$defs/rootStats" }],
        "type": "object",
        "required": ["root"],
        "properties": { "root": { "type": "string", "description": "Absolute pin-root path." } }
      }
    },
    "live": {
      "type": "object",
      "additionalProperties": false,
      "required": ["bytes_prefetched", "files_prefetched", "current_file", "workers"],
      "properties": {
        "bytes_prefetched": { "type": "integer", "minimum": 0 },
        "files_prefetched": { "type": "integer", "minimum": 0 },
        "current_file": { "type": "string", "description": "Path being prefetched now, or \"\"." },
        "workers": { "type": "integer", "minimum": 0 }
      },
      "description": "Live prefetcher state (pin.LiveStats). Zero-valued when prefetcher is nil."
    },
    "offline_mode": { "type": "boolean" },
    "cache_used_bytes": {
      "type": "integer",
      "minimum": 0,
      "description": "TRUE total on-disk JuiceFS block-cache size in bytes — the honest 'cache used' number. Sourced from the juicefs_blockcache_bytes gauge (every block read, NOT only pinned), falling back to a du of the cache dir when the gauge is unavailable. This is a SUPERSET of aggregate.cached_bytes (which is pinned-resident only). Consumers should display this as 'cache used' (pair with capacity.cache_capacity_bytes), and treat aggregate.cached_bytes/total_bytes strictly as the pinned-resident readiness fraction. ADDITIVE/optional: an older core omits this field (decode as 0); no contract_version bump.",
      "$comment": "Optional (not in required) so a pre-fix core that omits it still validates."
    },
    "capacity": {
      "type": "object",
      "additionalProperties": false,
      "required": ["over_capacity", "pinned_bytes", "cache_capacity_bytes", "shortfall_bytes", "disk_free_bytes", "cache_usage_bytes", "cache_free_floor_bytes", "cache_budget_bytes", "computed_sec"],
      "description": "pin.CapacityVerdict (capacity.go:46) — always present, snake_case already.",
      "properties": {
        "over_capacity": { "type": "boolean" },
        "pinned_bytes": { "type": "integer", "minimum": 0 },
        "cache_capacity_bytes": { "type": "integer", "minimum": 0 },
        "shortfall_bytes": { "type": "integer", "minimum": 0 },
        "disk_free_bytes": { "type": "integer", "minimum": 0 },
        "cache_usage_bytes": { "type": "integer", "minimum": 0 },
        "cache_free_floor_bytes": { "type": "integer", "minimum": 0, "description": "Effective JuiceFS free-space eviction floor selected at mount time; clients use this instead of a hard-coded percentage when reporting cache suspension or pressure." },
        "cache_budget_bytes": { "type": "integer", "minimum": 0, "description": "Configured JuiceFS cache-size budget, or 0 when unknown or unlimited." },
        "computed_sec": { "type": "integer", "description": "Unix seconds the verdict was computed." }
      }
    },
    "scanning": {
      "type": "array",
      "description": "pin.ScanningRoot[] (scanning.go:24) — in-flight pin-tree scans. Normalized to [] (never null).",
      "items": {
        "type": "object",
        "additionalProperties": false,
        "required": ["root", "files_found", "bytes_found", "since_sec"],
        "properties": {
          "root": { "type": "string" },
          "files_found": { "type": "integer", "minimum": 0 },
          "bytes_found": { "type": "integer", "minimum": 0 },
          "since_sec": { "type": "integer" }
        }
      }
    }
  },
  "$defs": {
    "rootStats": {
      "type": "object",
      "required": ["total_files", "ready_files", "pending_files", "failed_files", "total_bytes", "cached_bytes"],
      "properties": {
        "total_files": { "type": "integer", "minimum": 0 },
        "ready_files": { "type": "integer", "minimum": 0, "description": "Fully-resident files (warm progress = cached_bytes/total_bytes)." },
        "pending_files": { "type": "integer", "minimum": 0 },
        "failed_files": { "type": "integer", "minimum": 0 },
        "total_bytes": { "type": "integer", "minimum": 0 },
        "cached_bytes": { "type": "integer", "minimum": 0 }
      }
    }
  }
}
